{"lexemeId":"sha256:c5db6204bc9c227c9c5756485c81c1fe8680ee184b838325e00a0f6bc40d5400","level":"N4","method":"direct","confidence":0.8,"conflict":true,"policy":{"name":"direct-evidence-resolution","version":"1.0.0","selectedEvidenceIds":["evidence:cccccccccccccccccccccccccccccccccccccccccccccccccccccccccccccccc"]},"evidence":[{"evidenceId":"evidence:cccccccccccccccccccccccccccccccccccccccccccccccccccccccccccccccc","sourceId":"example-list-a","sourceRecord":"row-12","snapshotSha256":"dddddddddddddddddddddddddddddddddddddddddddddddddddddddddddddddd","capturedAt":"2026-09-15T00:00:00Z","assertedLevel":"N4"},{"evidenceId":"evidence:eeeeeeeeeeeeeeeeeeeeeeeeeeeeeeeeeeeeeeeeeeeeeeeeeeeeeeeeeeeeeeee","sourceId":"example-list-b","sourceRecord":"entry-9","snapshotSha256":"ffffffffffffffffffffffffffffffffffffffffffffffffffffffffffffffff","capturedAt":"2026-09-15T00:00:00Z","assertedLevel":"N3"}]}
