{"lexemeId":"sha256:c5db6204bc9c227c9c5756485c81c1fe8680ee184b838325e00a0f6bc40d5400","level":"N2","method":"inferred","confidence":0.61,"conflict":false,"policy":{"name":"conservative-lexeme-inference","version":"1.0.0"},"evidence":[],"features":{"maximumComponentKanjiLevel":"N2","kanaOnly":false}}
